<?xml version="1.0" encoding="UTF-8"?>

<!-- Schema must be removed before gameplay
<game
xmlns="https://www.w3schools.com"
xmlns:xsi="http://www.w3.org/2001/XMLSchema-instance"
xsi:schemaLocation="https://www.w3schools.com/xml VN_Schema.xsd">
  -->
<game>
  
  <!--Testing Animations-->  
  <conversation id="Anim_Test">
    <character name="Penny">
      <line AC_L="Test_AC" AC_R="Test_AC" emotion_L="Idle" emotion_R="Idle">This is the animation test.</line>
      <line emotion_L="Happy">Happy.</line>
      <line>Still happy.</line>
      <line emotion_L="Mad">Mad.</line>
    </character>
    <character name="Beautiful Friend">
      <line AC_L="Default_AC" AC_R="Test_AC" emotion_R="Sad">Sad. Oh, look, tan pill.</line>
      <line>Still sad.</line>
      <line emotion_R="Surprised">Surprised.</line>
    </character> 
  </conversation>

  <conversation id="Anim_Test2">
    <character name="Cinnamon Roll">
        <line AC_L="Test_AC" emotion_L="Surprised">Who are you?</line>
    </character>
    <character name="???">
        <line>wgfehrjgtkfhdwqwefgrhj.</line>
    </character>
    <character name="Cinnabon">
        <line emotion_L="Idle">Oh.</line>
    </character>
    <character name="wgfehrjgtkfhdwqwefgrhj">
      <line>wefjkgrdfglhgjafhdggjdgkldjhaefghgsa.</line>
    </character>
    <character name="Cinnamon Toast Crunch">
      <line emotion_L="Default">wefjkgrdfglhgjafhdggjdgkldjhaefghgsa.</line>
      <line emotion_R="does not exist">My emotions do not exist.</line>  
    </character>
  </conversation>

  <conversation id="Anim_Test3">
    <character name="Void">
      <line AC_L="Test_AC">I am the void.</line>
    </character>      
  </conversation>  
  
  <!--Testing Official Animations-->
  <conversation id="Official_Test">
    <character name="Penny">
      <line AC_L="Penny_AC" emotion_L="Talking" AC_R="Penny_AC" emotion_R="Idle">'Twas brillig, and the slithy toves</line>
      <line>Did gyre and gimble in the wabe:</line>
      <line>All mimsy were the borogoves,</line>
      <line>And the mome raths outgrabe.</line>
      <line emotion_L="AmazedTalk" emotion_R="Confused">"Beware the Jabberwock, my son!</line>
      <line>The jaws that bite, the claws that catch!</line>
      <line>Beware the Jubjub bird, and shun</line>
      <line>The frumious Bandersnatch!"</line>
    </character>
    <character name="Also Penny">
      <line emotion_L="Amazed" emotion_R="ConfusedTalk">He took his vorpal sword in hand;</line>
      <line>Long time the manxome foe he sought--</line>
      <line>So rested he by the Tumtum tree</line>
      <line>And stood awhile in thought.</line>
      <line emotion_L="Idle" emotion_R="Talking">And, as in uffish thought he stood,</line>
      <line>The Jabberwock, with eyes of flame,</line>
      <line>Came whiffling through the tulgey wood,</line>
      <line>And burbled as it came!</line>
    </character>
    <character name="Penny">
      <line emotion_L="SadTalk" emotion_R="Sad">One, two! One, two! And through and through</line>
      <line>The vorpal blade went snicker-snack!</line>
      <line>He left it dead, and with its head</line>
      <line>He went galumphing back.</line>
      <line emotion_L="AmazedTalk">"And hast thou slain the Jabberwock?</line>
      <line>Come to my arms, my beamish boy!</line>
      <line>O frabjous day! Callooh! Callay!"</line>
      <line emotion_L="SadTalk">He chortled in his joy.</line>
    </character>
    <character name="Also Penny">
      <line emotion_L="Idle" emotion_R="Talking">'Twas brillig, and the slithy toves</line>
      <line>Did gyre and gimble in the wabe:</line>
      <line>All mimsy were the borogoves,</line>
      <line>And the mome raths outgrabe.</line>
    </character>
  </conversation>
    
  <!--Testing Official Animations with Voice Over-->
  <conversation id="Genovese_Threat" voice="{eb4e9ad8-c6ac-414f-8d5e-c3d012ca6ae6}">
    <character name="Genovese">
        <line AC_L="Default_AC" AC_R="Penny_AC" emotion_R="Talking">Hehehehehehehe.....</line>
        <line>My, you've been a naughty girl..... >:3</line>
        <line>I was originally planning on letting you leave with only minor bodily harm, but...</line>
        <line>After the way you just pissed me off by rummaging through my things...</line>
        <line>I think I'd rather enjoy seeing someone clean what's left of you out of my carpet.</line>
        <line>Shall we begin?</line>
        <options>
          <choice id="No">No</choice>
          <choice id="Genovese_Threat">Restart?</choice>
        </options>
    </character>
  </conversation>

  <conversation id="No">
    <character name="Penny">
      <line AC_L="Default_AC" AC_R="Penny_AC" emotion_R="Idle">No, u.</line>
    </character>
  </conversation>

</game>
