<?xml version="1.0" encoding="UTF-8"?>

<!-- Schema must be removed before gameplay
<game
xmlns="https://www.w3schools.com"
xmlns:xsi="http://www.w3.org/2001/XMLSchema-instance"
xsi:schemaLocation="https://www.w3schools.com/xml VN_Schema.xsd">
  -->
<game>
  <!--Testing sprites-->
  <conversation id="3">
    <character name="Chibi">
      <line sprite1="01" sprite2="mermaid">Alright, Adult me, be honest.</line>
    </character>
    <character name="Adult">
      <line>What's up, Chibi me? Honest about what?</line>
    </character>
    <character name="Chibi">
      <line>Who do the people really want to see here?</line>
      <options>
        <choice id="Tan Pill">Tan Pill!</choice>
        <choice id="Mermaids">Mermaids!</choice>
        <choice id="No one">Neither!</choice>
      </options>
    </character>
  </conversation>

  <conversation id="Tan Pill">
    <character name="Tan Pill">
      <line sprite1="Player" sprite2="NPC">Aha!!! Tan Pill returns!!!!</line>
      <line>I'm glad to be back in the flesh!</line>
      <line>Guess that's settled!</line>
    </character>
  </conversation>

  <conversation id="Mermaids">
    <character name="Chibi">
      <line sprite1="01" sprite2="mermaid">Oh thank the stars...</line>
      <line>I'm really glad that the player picked us.</line>
    </character>
    <character name="Adult">
      <line>Now doesn't that feel better?</line>
      <line>Hope that helps with your insecurity!</line>
    </character>
    <character name="Chibi">
      <line>...</line>
      <line>didYouReallyHaveToBeThatBluntAboutIt??? 0_0</line>
    </character>
  </conversation>

  <conversation id="No one">
    <character name="Chibi">
      <line sprite1="01" sprite2="mermaid">...</line>
      <line>Guess that's settled...</line>
      <line>Ughhhhh...</line>
    </character>
  </conversation>

  <conversation id="Penny Test">
    <character name="Penny">
      <line sprite1="Penny_Happy" sprite2="Player">Is that who I think it is???</line>
      <line sprite1="Penny_Wow" sprite2="Player">GASPPPPP. IT IS!!!!</line>
      <line>IT'S TAN PILL, THE INSIDE JOKE!</line>
    </character>
    <character name="Tan Pill">
      <line>In the flesh! Or uh, in the Hypromellose Gelletin Alternative...</line>
    </character>
  </conversation>

</game>
