<?xml version="1.0" encoding="UTF-8"?>

<!-- Schema must be removed before gameplay
<game
xmlns="https://www.w3schools.com"
xmlns:xsi="http://www.w3.org/2001/XMLSchema-instance"
xsi:schemaLocation="https://www.w3schools.com/xml VN_Schema.xsd">
  -->
<game>
  <!--Testing animated sprites and voice lines-->
  <conversation id="Penny Test" = >
    <character name="Penny">
      <line AC_L="Penny_AC" emotion_L="Talking" AC_R="Default_AC">Yoooooo, Tan Pill!</line>
    </character>
    <character name="Tan Pill">
      <line emotion_L="Idle">That's my hastily assigned identification string! Don't wear it out!</line>
    </character>
    <character name="Penny">
      <line emotion_L="ConfusedTalk">What?</line>
    </character>
    <character name="Tan Pill">
      <line emotion_L="Confused">What?</line>
    </character>
    <character name="Penny">
      <line emotion_L="Talking">Uhh, anyhow! How goes there? You excited for this update vid coming out?</line>
    </character>
    <character name="Tan Pill">
      <line emotion_L="Idle">You betcha I am, poster girl, I MEAN, Penny!</line>
      <line>In fact, I'd say I'm so excited...</line>
      <line>*slidessssss out*</line>
    </character>
    <character name ="PENNY! :3">
      <line emotion_L="Idle" AC_R="Penny_AC" emotion_R="AmazedTalk">...THAT I COULD TRANSFORRRRRRRRRRRRRRM!!!!!!!!</line>
    </character>
    <character name="Penny">
      <line emotion_L="AmazedTalk" emotion_R="Amazed">WOAHHHHHHHHHHHHHH!!!!!</line>
    </character>
    <character name="PENNY! :3">
      <line emotion_L="Amazed" emotion_R="AmazedTalk">HAHAHAHA!!!!! I AM YOU NOW!</line>
      <line emotion_L="Amazed" emotion_R="Talking">What do you think, original, but slightly less handsome Penny?!!!</line>
      <options>
        <choice id="Cool">THAT'S SO COOL!!!!</choice>
        <choice id="What">What the actual hell???</choice>
      </options>
    </character>
  </conversation>

  <conversation id="What">
    <character name="Penny">
      <line emotion_L="AmazedTalk" emotion_R="Idle">What the actual hell?!?!?!?!!</line>
      <line>It's like looking in a mirror! Except... with DEPTH.</line>
    </character>
    <character name="PENNY! :3">
      <line emotion_L="Amazed" emotion_R="Talking">It's so flippin cool, right?!!</line>
      <line emotion_L="Idle">It's a shame that I can only sustain this form for one mor--</line>
    </character>
    <character name="Tan Pill">
      <line emotion_L="Idle" AC_R="Default_AC">...</line>
      <line emotion_L="Confused">Crap...</line>
    </character>
  </conversation>

  <conversation id="Cool">
    <character name="Penny">
      <line emotion_L="AmazedTalk" emotion_R="Idle">THAT'S SO COOOOOOOOOOOOOOOL!!!!</line>
      <line emotion_L="AmazedTalk" emotion_R="Idle">You even got the detail in my hair all flipped and stuff!</line>
    </character>
    <character name="PENNY! :3">
      <line emotion_L="Amazed" emotion_R="AmazedTalk">I'm proud of all the detail, heck yeah!</line>
    </character>
    <character name="Penny">
      <line emotion_L="ConfusedTalk" emotion_R="Idle">Though I will say, the artist who drew you... me?? We?? Yeah we.</line>
      <line emotion_L="SadTalk">Whoever drew us should have probably made it so that this form lasted a little...</line>
    </character>
    <character name="Penny">
      <line AC_L="Default_AC" emotion_R="Idle">...</line>
      <line >AHHHHHHHHHHHHHHHHHHHHHHHHHHHH!</line>
    </character>
    <character name="PENNY! :3">
      <line emotion_R="AmazedTalk">AHHHHHHHHHHHHHHHHHHHHHHHHHHHHHHHHHHHHHHHHHHHHH!</line>
    </character>
  </conversation>

</game>
